{
  "asset": "gold",
  "sources": [
    { "id": "lbma", "price_usd": 2345.50, "timestamp": "2026-06-12T18:00:00Z", "reliability": 0.95 },
    { "id": "comex", "price_usd": 2348.20, "timestamp": "2026-06-12T18:00:00Z", "reliability": 0.92 },
    { "id": "retail_feed", "price_usd": 2410.00, "timestamp": "2026-06-12T17:30:00Z", "reliability": 0.40 },
    { "id": "ecb_ref", "price_usd": 2346.10, "timestamp": "2026-06-12T16:00:00Z", "reliability": 0.90 }
  ],
  "outlier_threshold_pct": 3.0,
  "min_sources": 2
}
